commentaire,rating,source
Incompatible with my new tablet. This is ridiculous. (Lenovo Tab Plus),1,Google Play
Ever since the latest update I've been having a hard time doing returns because it's run by AI. I've tried numerous time with no luck.,2,Google Play
2026.02 not able to rearrange wishlists. OLD still not fixed: Make it possible to save print & label as pdf ON MOBILE. It's forever been a problem and still isn't a feature! Everytime I click print label it just refreshes the page in app. If I try to send myself the link in email it opens the app and does it again. If it opened in browser I could select save to pdf. So I have to do this in a roundabout way by going on desktop and send the pdf.,1,Google Play
"This app is very user-friendly and easy to navigate. So far, it runs smoothly without any issues. I’m really satisfied with the overall experience.",5,Google Play
amazon is a great place to get well anything and everything you may need and at a phenomenal deal great over all company !!!!,5,Google Play
"I don't know what has happened, I used to frequently buy bits and pieces from this app, then after one of your updates last year, it all went downhill. My purchase history is gone and it keeps telling me that most items aren't available to be shipped to my location, it's infuriating. At this stage, if I could review with no stars, it would be that.",1,Google Play
"TQ MAKE MY DAY ..EASY GOOD TO I FIND MY THING , MY SHOPPING SHOP..HEHEHEH THE GOOD IDEA OF APPSS",5,Google Play
Great place to shop Great prices,5,Google Play
"my app keeps crashing, I can't click on certain things, some products won't fully load or let me click through options. Even when I go to male a purchase the app will crash leaving me to dbl and triple check of the purchase went through or not. It's frustrating trying to shop on the app now.",1,Google Play
"all good, only sad part is some sellers dont sell and ship to south africa, and every country has their own selling platform.",4,Google Play
It's Amazon,5,Google Play
I ordered a phone and yogurt. the driver kept my phone and delivered the yogurt. it's easier to just go to Walmart or Costco.,1,Google Play
"Amazon's predetermined limited range of filters is so restrictive. Unfortunately, we're a slave to this corporation.",1,Google Play
"Exceptional app. super fast delivery, like no other shopping platform ... highly recommended 10 stars",5,Google Play
It was useful,5,Google Play
"Mostly cheap, some products can be found cheaper on other sites like Takealot. The free delivery is bu far the best.",5,Google Play
thank you for making me feel so welcome 😎👍,5,Google Play
not available in my region 😕,1,Google Play
"if I ever need anything, I know that I can get it from Amazon and the delivery will be fast.",5,Google Play
For the most part I get everything just right for me 💖💖,5,Google Play
Quick and easy to use. lots of variety on items. Need to expand on shoe options,4,Google Play
برنامج جميل وفيه كل حاجة,5,Google Play
"try make order all time long time to ship, app send lot spam get prime, if you no get prime spam dont stop, ok get prime magic 2day ship,?, no no ship realy bad app now, cancell prime but never refound lost time and money👎",1,Google Play
the best app in the world. the app is commpare to daraz,5,Google Play
good,4,Google Play
"Amazon is a comprehensive online retail platform that provides a diverse range of products and efficient delivery services. Its user-friendly interface enhances the shopping experience. Nevertheless, improvements in customer service efficiency and return management could further strengthen overall user satisfaction.",5,Google Play
very good I'm impressed,4,Google Play
good,5,Google Play
"I used to order from Amazon all the time and now it signs me out everytime I use the app and when I try to sign back in it just says ""we've detected unusual activity on your account"" at first I believed that so I changed my passwords when it automatically signed me in and then once more it forcefully logged my account out and now I cant even access my account I have an order in place right now and I cant even check the shipping status because of this.",1,Google Play
It's a nightmare I have mental health problems and I'm disabled and they won't let me sign in,1,Google Play
"Amazon Cust. Spt instructed me to uninstall the Amazon Shopping app (Google Play) from my Samsung Galaxy Tablet A8 (2022) because I was switched to Amazon Japan vs US and there was no way to switch back (which is disgraceful design). I uninstalled, & with the guy still on the call found I couldn't reinstall the Amazon Shopping app on my tablet. WTH. I do all my frequent Amazon shopping from my tablet app. I will Not shop via browser on my tablet. When will the Amazon apk devs address/fix?",1,Google Play
Waiting to place first order this month. Will know more once order details are given and delivered. Wishing The Best.,4,Google Play
I always get as described ta mates that was easy,5,Google Play
اقوى برنامج طفرني,5,Google Play
i love amazon it delivers my 📦 package neatly and well mannered i love amazon ❤️♥️,5,Google Play
"It so easy to shop. I have , when not feeling well been able to get the things I need easy and fast.",5,Google Play
bad can't install ?????????!!!!!!!!!!!!!!,1,Google Play
This isn't available for my device ??? !!! Android tablet is 1 year old. 🤪,1,Google Play
yourapp is confusing your computer can't interface with Mine and I can't get on line,1,Google Play
"terrible app. reset password, doesn't work. reset a second time. it works. try to log in, restricted. try spending an hour on the phone. went back to eBay remembering how fkn terrible Amazon actually is for everything except finally finding something useful (rare as fk)",1,Google Play
Why does my Amazon app all of a sudden show Arab Emirates instead of the US??,1,Google Play
"new update sucks, finding things has become way harder and the app design looks cheap and seems cluttered",2,Google Play
"Locked me out after I changed my phone number, zero customer support assistance when requested. Automated walkthrough provides false information on how to fix, app is now bricked.",1,Google Play
Never had a problem with Amazon's mobile app.,4,Google Play
Just bought a Google Pixel 10 Pro paid...but no receipt,1,Google Play
Good for reviews. The shipping times are becoming deeply inaccurate.,3,Google Play
Update for tablet use needed!!,1,Google Play
UI/UX design is super poor. When my LTE is a bit weak I can not open my list/order/history. Glitchy app.,1,Google Play
"it just constantly telling me uh ohh something went wrong. its like, hey you might like this, check it out...uhh ohhh sike",2,Google Play
I love shopping on here cuz it stops me from going outside to the stores to be looking for things that might not be there at Amazon has it all,5,Google Play
Great amazon shopping,5,Google Play
تم الغاء عملية الشراء بسبب التأخير والى الآن لم يتم إسترداد المبلغ منذ ثلاث أسابيع وللأسف لا يوجد خدمة عملاء للتواصل..,1,Google Play
Took money out of my debit card without permission even though I have no Amazon account.,1,Google Play
it's taking a long time to load on my phone,1,Google Play
Bait and switch tactics. It says overnight and once you purchase it gets kicked to Monday. They lie about not having access to the Amazon lockers. This is my official last time purchasing Prime membership since you guys literally can change the ship time whenever you want and I have to deal with it. 👎,1,Google Play
"if you add something to your list or add it to the cart and then think about it for a couple of days, Amazon will instantly raise the price of that item. so buyer beware. and because of that I am limiting my purchases through Amazon because that's bad business and it sucks.",1,Google Play
"new AI return prompting not working, gets stuck on ""OK, was there anything inaccurate about the product description or images? If so, please describe."" and unable to continue return on mobile",1,Google Play
"this app doesn't seem to be available for the Samsung A11+ in the United Kingdom for some reason and tells me it's not compatible anymore, what is going on with the A11+?",2,Google Play
"sloppy experience. I suggest trying to find what you are looking for without typing it into the search bar. Instead, shop by department, then category and try using the filters you can click on to try to narrow down your search and see how close you can get to finding your chosen product. Even when searching with the search bar, Amazon is more interested in offering what they think you might also purchase instead of what you searched for. ""sponsored product"" is also out of control as well.",1,Google Play
O app nao te deixa pedir reembolso de compras em que enviaram menos itens do que foi pedido,1,Google Play
Suddenly stopped working on Samsung tablet after having worked for years. Tried uninstalling and reinstalling and says not supported. Goodbye Amazon prime.,1,Google Play
app crashes with every search attempt since the most recent update. completely unusable.,1,Google Play
"amazon, dangerous company, boycott them and it's owner",1,Google Play
"Will not play videos in product images, and cannot back out once a video has been opened. Crashes and loses text I typed when trying to add a picture to a review.",1,Google Play
It's a really easy and straightforward shopping experience every time 👍,5,Google Play
love amazon they always get my orders here fast.,5,Google Play
"App no longer allows me to take a long screenshots anymore!!!! oh sure, the app allows a regular screenshot BUT my Samsung s25 lets me take entire page screenshots but cuz Amazon thinks I want to share the screenshot I just took, it stops me dead in my tracks from being able to scroll the page while taking a long screenshot at the same time!! it keeps constantly popping up a full page bunch of nonsense trying to get me to share it to all these different platforms!! What a joke!!!!!!",1,Google Play
always had great experiences with Amazon,5,Google Play
Mein Konto ist immernoch gesperrt obwohl seit über einem Jahr alle offenen Zahlungen beglichen wurden. Kundenservice ist entweder nicht erreichbar oder keine Hilfe.,1,Google Play
no good,1,Google Play
"i swear if ur package is ""lost"" you never can get ur money back its actually crazy",1,Google Play
"It's very irritating that you can't use the app to remove a payment method, only add one. And it was also not letting me complete a return today. Luckily, I have a laptop to pull up the website so I don't have to fight with the useless customer service bot.",3,Google Play
"Most orders arrive when the listing indicates. I've been finding many, recently, that will say they will deliver today, but once my order is placed, it changes to a next day or later delivery time. My job requires me to travel. When I place an order based on that delivery time, I need it to be reliably delivered at the time indicated by the item post. Also, some street addresses in complexes have several circles with lot numbers.",4,Google Play
good app to download it on your phone,5,Google Play
Poor after-sales service,1,Google Play
The app keeps crashing!,1,Google Play
too many updates,1,Google Play
"Great app. But the ai thing says there's a retry payment method right by the order. I've looked and no button. please fix this. It would be great if it was below the Big revise payment button. when it needs to be revised but with ""retry payment method"" underneath the revise payment. thank you.",5,Google Play
"What is going on with delivery. Everything is being delivered to the wrong apartment!!!! When I call, the manager tells me they can only deliver to the front apartment! WTH!! I'm looking for another service provider after 10 years! FURIOUS 😠",1,Google Play
Muy bueno👌🫠,5,Google Play
"Basic operation is piss poor, as it stands at the moment it's not fit for purpose. Needs updating to fix what they have broken asap!",1,Google Play
"Uninstalled. This app gives you sponsored listings, ads, Rufus, and garbage AI results. Not much more. Better off shopping elsewhere.",1,Google Play
"App software suddenly started pulling in decades old orders but hid recent ones. The developer works for a pass-through company that buys and sells items then switched products out without the purchaser's knowledge. They used the app history to pull old orders trying to get ""good"" reviews but failed to realize some of that stuff they sold during the pandemic was trash or stolen then switched by their own packaging or shipping people. Stop misusing AI service. Cannot darken screens on either app.",1,Google Play
"new ""ai"" returns won't allow you to return via the app because it won't generate a response. have to go on website to return",1,Google Play
This app keeps crashing on my android phone! I'm hearing is only happening on Android! Please fix it app is crashing again today in Feb 2026. what is the problem!!??,1,Google Play
since update no longer works on android tablet only on phone. Useless as I used my tablet more for shopping than phone. Thinking about cancelling all my amazon prime and music unlimited as not getting a full service anymore. Amazon need to re-think this.,1,Google Play
Excelente! always find what I look for and much more!!!,5,Google Play
"seems like everything I order gets delayed, or the same day delivery stuff doesnt show up. stop having same day delivery if you cannot fulfill the promise. disrespectful",2,Google Play
it is a great app and easy to use and it is well laid out 👍👍👍,5,Google Play
it's consistently crashing. I can't search for anything before it closes out,3,Google Play
There is no clear way in the app to report a bug in the app. I tried to make a return and can't proceed with they new AI feature. There is no way to enter an answer. I took a screenshot and when trying to find a tech support there's a lot of functions and they all are looped back to the beginning. crazy things how they do everything complicated for customers. can you please send me a link how to report bug?,1,Google Play
Love Amazon Great items,5,Google Play
"horrible customer support, they cancelled on me an order, didnt even the decency to update me that they canceled the order, when i went to customer support, instead of helping me they start debating with me, a joke and scammy company, thank god i can count with one hand the times ive bought stuff of off them, they make you wait for your refund when there is a problem on the side of the supplier, and instead of helping in the situation they wont trasnfer you to someone more empathic",1,Google Play
"I love the amazon shopping app, here lately I can't use it because it keeps crashing. I have updated it and tried to clear out everything it's said to do. Still crashes when I get on to the app shopping app. I can't even look on the website because it's sent me shopping app. Please fix.",2,Google Play
good,5,Google Play
"Awesome,They Come 2 Your Home,Good Prices,Nice People....",4,Google Play
"slow as hell now. difficult to customize pieces, very frustrating. makes me look more on eBay.",2,Google Play
used to work fine but keeps force closing when trying to shop. help?,3,Google Play
too hard to open my own account???? (WHY),5,Google Play
good,5,Google Play
rubbish,1,Google Play
Love it so easy!!,5,Google Play
"the new updates are making everything harder, click on cart gets ads, i have to repeatedly click on cart icon to get to my actual cart. not to mention all the useless ai additions, all the summeries and product info are just talking in circles, and you get NO actual useful information.",1,Google Play
I don't know if the program the app or the algorithm but sometimes your purchases do not go the way that you want them to sometimes when you create an order it changes the dates on you and I've complained to Amazon about this but they don't seem to care or want to fix the problem,1,Google Play
"""sepetim"" kısmında ürün aradıktan sonra tekrar ""sepet"" ikonuna basınca sepeti göstermiyor, aynı ekranı yeniden gösteriyor ve bu durum çok sıkıcı",1,Google Play
"Shipping has become a week or more now. Promised in 2 days then they lose it, where walmart has delivered. Also, lately I am finding the same items on Walmart app at a lower cost. Amazon is getting worse by the day.",1,Google Play
of course I like amazon but i have been stuck in a continuous loop on the app trying to speak to a person even a chat but it just goes in circles never bringing you there i have placed an order wich says buy in next hour for next day early morning delivery and of course rite after I pay it now says 3 days for shipping and this happens way to often and I am extremely frustrated and if I click on item to buy again it again says next day delivery 4am to 8am so why is mine 3 days after I pay happens,1,Google Play
Easy to order and find thing's,5,Google Play
"The app has a bug and I've been trying to use it recently without success because when I open it, it just closes on its own. Please fix this.",1,Google Play
dissatisfied Gmail stops working all the time,1,Google Play
The app started spamming notifications unrelated to orders or offers (just telling me stuff like 'You friends are buying it already - just one more click'. These notifications cannot be disabled without turning off the system notifications for the app. Annoying as hell,1,Google Play
wouldn't recommend,1,Google Play
absolutely the best to shop at 😊😊,5,Google Play
Bad update! It closes every time you try to look for something!,1,Google Play
great options and discounts,5,Google Play
"1,Very unprofessional way of dealing with customer 2, very unprofessional and bad behaviors from the drivers",1,Google Play
"App werkt redelijk, maar ik erger me mateloos aan de automatisch spelende reclame filmpjes en de ""gesponsord"" troep die de zoekfunctie er niet bepaald beter op maakt. Als ik zoek op een specifiek merk, dan zit ik niet te wachten op generieke Chinese ""alternatieven"", Amazon! (zeker niet als de verkoper negen van de tien keer direct vanuit China verscheept en je dus bij problemen torenhoge verzend kosten zou krijgen voor de retour)",4,Google Play
after update cannot return,1,Google Play
"Useless bloat. Didn't ask. Don't want. Lacks a couple website features we regularly use. Dropped ASAP, mostly because we strongly prefer PC browser interface.",1,Google Play
easy to use,5,Google Play
ok,5,Google Play
"The most recent update is terrible. anytime you add an item to your cart it brings down a buy again banner. if I wanted to buy it again I would have been searching for it. however, most the items that pop up are not something I want and is more intrusive and time wasting than anything.",1,Google Play
"its not working at on my s25 galaxy , the app isn't working at all keeps crashing no matter what I do had to put in a deep sleep",1,Google Play
I DON'T WANT PRIME!!!!!!!!!!!!!!!!! 🤬🤬🤬🤬🤬🤬🤬🤬🤬🤬🤬,1,Google Play
"Golden smoke sardines on sale for under $36. 18, 2$ a can. $3 at the store.",5,Google Play
it takes too long to deliver your stuff even with prime,2,Google Play
The app could use some work. Slow at times. Constantly having to close and reopen because it just stops working.,3,Google Play
my favorite place to shop,5,Google Play
Too easy. My fav app,5,Google Play
"Honest product rating was not allowed. The products I buy and like, I give 5 stars to. But, on one order something was not right. So, Amazon did not post rating for 1 star review. I received an email saying ""inaccurate information. Does not meet community guidelines"" after posting a 1 star rating for the poor performance of a lithium-polymer battery that was advertised as a lithium-ion battery.",1,Google Play
Such an easy app to use. I used it literally everyday! any purchase I am planning to make gets a look on Amazon! The only thing that really needs to be added is dark mode.,5,Google Play
good,5,Google Play
you should be able to get this app on any device,1,Google Play
shopping at Amazon is easy,5,Google Play
horrible support,1,Google Play
I find that they are good 😊,5,Google Play
doesn't allow dark mode,1,Google Play
so easy to shop,5,Google Play
Why is it no longer compatible for tablets? I don't understand why Amazon would do this.,1,Google Play
"Google took the money out of my account for my Amazon prime subscription and then did not pay my subscription, there is no customer service, so they stole $16.26 and I cant do anything about it.",1,Google Play
"This is so easy, I'm able to order just about anything especially for my Mom & have it sent straight to her.",5,Google Play
"my first order I've gotten is broken, they won't give me a refund, and they say my account is ""too new to leave a review"" so I guess they just don't care about new customers feedback",1,Google Play
"What would we do without Amazon?? I mean, SERIOUSLY!!",5,Google Play
never on time,1,Google Play
Shopping with Amazon has made finding and purchasing items so easy I would recommend using it for nearly all of your needs and the options are phenomenal there are so many ways to make purchases and you can take as much time as you need to shop on your own time almost anywhere. I have used Amazon for many years now and have never had any packages not delivered and there delivery times are super fast with prime.,5,Google Play
they constantly send me the wrong thing,1,Google Play
need to shop,4,Google Play
"at First Amazon prime was worth having 1 day Delivery, but all 2025 packages that are supposed to get delivered in one day, have been taking 3-8 days witch is rediculous knowing im paying. Amazon is getting too busy to keep up",2,Google Play
