commentaire,rating,source
"Terrible Service. Do not sign up for Prime. It has become greatly devalued. They failed the same item I ordered 3 times in a week and lied they were going to watch it very closely. You no longer get items in two days for Prime. I just placed an order today July 14th, and it will not be here until July 24th. Buh-bye Amazon, this is what happens when a company gets too big and loses its great customer service. As soon as my membership is up I'm moving on. You can't use Covid 19 as an excuse.",1,Google Play
the app is very slow and lags quite often on android devices. the service provided is good but app needs a few updates,4,Google Play
Using this application makes shopping easy...save time and the items sold are also of very good quality,5,Google Play
worst customer care service.. bad,1,Google Play
"delivery times are often incorrect, NEVER rely on the delivery time if you need something quickly",3,Google Play
amazing 🤩😍,4,Google Play
"Decent shopping experience but: 1. Very different shipping prices for different items and very often impossible to have combined shipping. 2. No special Amazon Prime perks for smaller EU countries such as Malta. Either independently or by using a different region such as Amazon.de. 3. Doesn't have enough interesting clothing. Most of it is bland and boring. Unless you are looking for something very specific such as climbing shoes, it is bot worth it.",3,Google Play
as of yesterday it keeps kicking me out bc there is a bug wish they would hurry up and fix the problem,3,Google Play
so easy to buy everything and anything Prime is a must,5,Google Play
"I’ve been using the Amazon app for a while now and it’s always a smooth experience. It is very easy to find what I need, and the tracking updates are always accurate. It makes shopping much less stressful",5,Google Play
Every time I try to pick up my order from a pickup location (that requires Bluetooth to access) the app won't load. I've tried for several days and now my order is being taken back and refunded a second time. The AI assistant is no help and there's no way to request an extension. The unreliability of the app is enough for me to quit using Amazon altogether.,1,Google Play
always neat things to find,5,Google Play
I lv this,5,Google Play
very professional 😄,5,Google Play
exellent,5,Google Play
"Horrible search feature. I typed in ""Garmin watch"", only 4 out of the first 10 results were Garmin.",1,Google Play
no longer compatible with my tablet. can you fix this please.,1,Google Play
This service has become terrible because their drivers cannot follow the directions of an electronic/digital map that takes you directly to the exact GPS coordinates. AND will even show you a satellite photo of the location. So frustrating to get pictures of unknown front porches with your packages sitting out in the rain 🙄 With all of the trillions this company makes you would think that they could train these drivers how to deliver a box 🤨,1,Google Play
This app constantly crashes. Immediately as soon as I search for an item it closes out. I can't do anything with it and its super frustrating.,1,Google Play
"I ordered an item 5 days ago that was expected in two days for a job I'm doing, I told my client I would finish that job in 4 days. now I'm looking for that item elsewhere because it still has arrived and my client is pressuring me to finish that job.",1,Google Play
"I can't get HALF the stuff I used to be able to, since we can't archive our orders! Call me horrible- I know I'm not the only one that buys things without my husband knowing sometimes. I USED to love ordering things on Amazon but since I can't archive orders anymore, my purchases can be seen by my husband & daughter, so that screwed me! Now I have to shop elsewhere. The little shopping I still do on here just became INCREDIBLY annoying with the new update! Don't think I'll be needing this app.",2,Google Play
quality items and is always on time,5,Google Play
Amazon fire showing inappropriate ads to my children on child locked accounts??,1,Google Play
app works fine but I am going to use it a lot less because of not being able to switch it to dark mode. I will stick with my browser.,3,Google Play
app keeps crashing. phone reports it has a bug and needs developer to fix....please fix,1,Google Play
Thanks so much 😊😊😊😊,5,Google Play
best quality products,5,Google Play
No longer worth it. Went from overnight deliveries to 2 days to now 4 days for a delivery. This has been happening over the course of months and is not isolated to just one product. I had to make the switch to Walmart.,2,Google Play
"Dear Amazon, I dont pay for prime so my orders can be delivered by our sorry local post office and you make sure theres nowhere on the app to complain about it.",2,Google Play
please please add dark mode 🙏🙏🙏,3,Google Play
super fast delivery.,4,Google Play
cant even make a purchase without it canceling the order and customer support doesnt tell me anything,1,Google Play
I like it,5,Google Play
Always absolutely professional being able to order and receive from Amazon so guickly and easily with out leaving my home.,4,Google Play
I love the convenience. Keep an eye on prices.,5,Google Play
👍👍👍,5,Google Play
Great job!,5,Google Play
I never get my package stolen when using eBay or Walmart to get my package but when using Amazon it always does,1,Google Play
so convenient,5,Google Play
This was first delivery at this location and it was great.I had never tried sending to a new location but it was good.,4,Google Play
LET ME CANCEL MY SUBSCRIPTION!!!,1,Google Play
"For the love of God stop replacing everything with pictures and toddler like layouts, use words like a literate human. Put scroll bars back on the sides so we can actually scroll down the page when we want to. Get rid of all the stupid side scrolling items that get in the way of page navigation. Make an option in app notifications to separate advertising notifications and delivery notifications. Let us turn off e-mail notifications. Stop making subscriptions the default for every single thing.",1,Google Play
the app keeps defaulting my delivery address to the wrong place. fix this now.,1,Google Play
need to see human amazon wigs,5,Google Play
"The ""preview"" feature Amazon keeps trying to force on us is annoying and makes scrolling through search results needlessly frustrating. We don't want it. Stop.",1,Google Play
MUY MALA EXPERIENCIA YA QUIEREN ENTREGAR LOS PRODUCTOS DESPUÉS DE 3 SEMANAS APARTE QUE SIEMPRE POR CADA COMPRA QUE HAGO CON LA TARJETA SIEMPRE ME DESCUENTA 20 PESOS QUE PARA VERIFICAR SI TENGO DINERO QUE SEGÚN ESE CARGO LO REGRESAN CUÁNDO NO ES CIERTO IMAGÍNENSE SEGÚN ELLOS ENVÍO GRATIS PERO POR CADA COMPRA QUE HACES SE VAN DE 20 EN 20 EN 20 EN 20. PUES NO PINCHE SINVERGÜENZAS ESTAFADORES. ABUSIVOS!!!!,1,Google Play
"It keeps glitching and closing out... not properly searching, or allowing me to order items. Take my money, charge me extra for groceries, books, and movies/ shows but still... overall... don't work... sounds fair (sarcastic for those who are unable to comprehend)",1,Google Play
"pathetic customer service,just requested to delete my account but taking ages to do that simple task",2,Google Play
whoever decided to put the add to order on the page below the add to shopping cart is dumb. you're confusing a lot of people that may not want that item shipped right away.,1,Google Play
"Apparently, it's literally impossible for me to do business with Amazon. My card doesn't give me trouble with anyone else. I tried signing up for an Amazon card to get around this (which is absurd enough to have to do by itself), got approved, but Amazon wants me to tap the physical card to the phone. I selected digital only on sign up, there is no physical card. I shouldn't have siged up to begin with. Edit: they have locked my account.",1,Google Play
"fast. convenient. easy. may be minor issues but overall great service, delivery and customer service.",4,Google Play
"It suck, not good would not except my gift card.It was a debit cards, money upfront, still wouldn't let me use it.",1,Google Play
So apparently it was a while ago but I had a $25 Amazon Gift card and ordered this Lulu necklace and my payment never went through and I need a refund because I told customer support and nothing happened after that so apparently it got scammed,3,Google Play
SO Much Delivery cant reach And I Dont Get My Refund! Definitely a 1,1,Google Play
just deleted this app. they want me to tap my card to verify the payment.. nahh I don't need useless junk that bad,1,Google Play
Very satisfied,5,Google Play
the orders are very glitchy you click on a order and it takes you to a opposite order you did not click on to see very glitchy app,1,Google Play
Everything is great!,5,Google Play
It keeps closing due to a bug.,1,Google Play
Beware Amazon is not what they were. Shipping is very slow and customer service is garbage. I keep getting charged for a package that Amazon lost. I have to call them. Which you have to Google to find. I wade through there AI for half an hour to finally get to a live person. Get my refund then a few weeks later they go and charge me again for the same lost package. I am on my third refund for the same package and they say there is nothing they can do. I am done with them.,1,Google Play
"New update, now can no longer open details of items or look at individual items . can't see the pics, everything is a summary on one page . this will stop me from ordering , and I only shop amazon .",1,Google Play
"Amazon sells practically everything, so convenient, saves gas money, shipping fees and great customer support. Amazon is always the first place I search with the option of selecting lowest prices first and other filters.",5,Google Play
Okay for ordering and tracking orders but very limited beyond that - can't buy Kindle books and does not allow management of subscriptions. Poor. Come on Amazon sort it out!,1,Google Play
best*more...*,5,Google Play
AI and China are ruining Amazon experience,2,Google Play
Super-convenient.,5,Google Play
"my hand Cross my heart this is the last time i will ever use this App in Canada or anywhere reasons items didn't arrive after 3 months and once i called to get some info the cancel my item without my permission Bought the same item twice by mistake, after 30 seconds i called them to cancel 1 of the to orders they told me to wait 48 and they didn't expect my refund therefore AMAZON is no longer my first or second or last option.",1,Google Play
I don't like that they added the fresh cart. its completely seperate from the regular cart. I didn't realize that something I bought even went into that cart. I thought I ordered all my stuff. nope I did not.,3,Google Play
great app,5,Google Play
"The app is nice and easy to use, however, what good is it, and why should I have to upgrade my devices now that I can't afford it just because I have a reliable tablet that works well but happens to be older. So I think that we will just be going back to old style. Thank you.",1,Google Play
"Not compatible with my Galaxy A9 tablet; I'm disappointed that Amazon have taken the decision to end support for tablets. Whilst a phone is convenient, a tablet offers a better viewing experience.",1,Google Play
"This app used to work on my tablet, android 13, .become corrupted, I deleted the app, now it is not available. Amazon get your act together.😡Deleted",1,Google Play
"Has a bug, now unusable, please fix!",1,Google Play
great stuff at fab prices,5,Google Play
"billion dollar company app experience - horrible UI lag, absolutely nothing about navigation is snappy. trying to browse or view different product options feels like being back on dial-up to the point it's not even worth browsing after 5 minutes. navigation requires far too many click thrus and no efficient way to return to a previous page. what do UI/UX people even do? 🤷‍♀️",1,Google Play
"App crashes every single time I make a search. Forced stop on app, cleared cache, still crashes.",1,Google Play
bug on app that closes it within 10 seconds of opening. pls fix asap,1,Google Play
Easy process.,5,Google Play
the new ai experience is is seriously lacking in the returns option. asks a question and then you can't type your reply no reply box. recently bought a new pair of shoes that some one wore in the mud...,1,Google Play
greatest thing ever so easy and so much fun to use,5,Google Play
"Amazon should be called, creators home 🏠",5,Google Play
customer service is very bad .....named mostafa......better to chat or talk with ai than your human tram....absolutly poor service from saudi arabia,1,Google Play
"the new update is so stupid and annoying. you can't swipe through the pictures anymore, you are stuck with whatever picture is in the thumbnail which is so small it's hard to make anything out and you can't click on it to enlarge it. I fact clicking on it just takes you back to the same exact thing. the lay out is to cluttered now with information I don't care that much about. I will no longer be using Amazon until they revert it or come up with a better user interface because this one sucks",1,Google Play
Cant install on Samsung tablet.,1,Google Play
"So I had a scheduled pick up of couple of items for Amazon from this DRAGONFLY today on Feb 19/26 they sent Me an email in the morning and said we're on our way to pick up your package, I waited all day at home and at around 8 o'clock at night i got a text message saying that some Indian guy named DEEPAK will pick up my package and around 9 o'clock I got an email that Deepak tried to pick up packages but couldn't, I was home all day Deepak never called or buzz , so Deepak lied",1,Google Play
having problems with the dim screen control,3,Google Play
"easy to use, trustworthy",5,Google Play
You can get your shopping done if you know what the item details are. The search feature is very inefficient. The site is difficult to use if you are shopping for items and want to compare prices as a details.,3,Google Play
Overpriced tack!,1,Google Play
amazing,5,Google Play
prices are so high on the app,2,Google Play
"WHATS GOING ON???? NOT COMPATIBLE WITH TABLET!!!! I hate using the web, the app was so much easier, please sort this out. I have it on my phone but not on my tablet, this is ridiculous, please fix it!!!",1,Google Play
"2/22/26 phone was on vibrate with no sound, plus do not disturb. No apps are allowed through yet this app repeatedly wakes me up at 2 or 3 or 4 am with notification sounds for stupidness like sales on items I have zero interest in. I'd also love it if I could also ONLY get important notifications (which respect my SYSTEM WIDE volume and alert settings) instead of SPAM that alerts me a dozen times a day for junk. Rufus is useless as is the app. At this point 99% of results are sponsored.",1,Google Play
BUYER BEWARE AMAZON HAUL This review is specific to Amazon Haul. Recently I had an undelivered order. Per normal Amazon refunded the items. The import charges totally over $20 of and $132 dollar order are not refundable per Amazon Policy. So be warned if you don't get your items you will only get a partial refund,1,Google Play
excellent,5,Google Play
doesn't allow me to keep purchases private.,1,Google Play
"I feel like the ability to schedule an order would really help all these issues with payments occurring too late. I would love for you to be able to run my card automatically after I get paid, basically. You can do a whole marketing campaign on that alone because nobody does it. I'd feel good knowing I have the order placed ahead of time before I got paid so nobody else can snatch up that money first. You're welcome to whoever submits the idea.",2,Google Play
"It would be convenient for customers and lucrative to business if we could schedule a purchase. It's a simple idea, but may be revolutionary.",3,Google Play
Used for 20 minutes and my phone turned into a furnace. This app has always caused heat problems on various phones but it's gotten so bad I uninstalled.,1,Google Play
Not updated so can't be used on tablets. Very inconvenient.,1,Google Play
"""It is unacceptable that Amazon's system clears my entire cart when I only purchase a few items. I spend months finding specific products, and losing them all at once is a major issue. Please fix this so that unselected items remain in my cart or are automatically moved to 'Saved for Later' after a partial purchase.""",1,Google Play
Still no dark mode,2,Google Play
it's really amazing,5,Google Play
Amazon is allowing people to sell sex dolls that look like little girls that is pedophilia even if its not a living thing it normalizes pedophilia Amazon needs to sue and remove that product if they don't they obviously support it,1,Google Play
great,5,Google Play
Great app,5,Google Play
"App freezes when selecting options for items ( color, size, etc.).",2,Google Play
no longer compatible with my tablet?,1,Google Play
"I never shopped Amazon before, but heard great things. We decided to become prime members, and I absolutely love it. I order for school (teacher) and home. I also am a fan of the grocery items. I have never had a problem with my orders except for one delivery guy who threw one of my packages and took a picture as he did it 🤦🏻‍♀️.",5,Google Play
this is my everything 🙏❤️❤️💯,5,Google Play
its not a matter of stars since the last update I can not order at all tells me there is a Bug the app editor needs to fix so I can order again 😌😔😪🤤,2,Google Play
"my name is MD JUBAIR MULLA - Hello, Amazon 👋👈",5,Google Play
all day it shuts down! can't do anything! fix this bug!,1,Google Play
works great but needs dark mode option,4,Google Play
i hate the erroneous long press on items,1,Google Play
amazon keeps charging me for prime and won't refund my money,2,Google Play
Give me dark mode,1,Google Play
love Amazon,5,Google Play
That's not fair i've been a customer for a long time and they said there's a credit card fraud or something like that yeah I guess I'll never come back here again forever,1,Google Play
THE AI TRASH HAS TO GO. NOW.,1,Google Play
New forced AI return feature doesn't work. can't select a reason for the return.,1,Google Play
how do you not have your app compatible with Samsung tablets?,1,Google Play
Often late. As in days... Frustrating. Oftentimes I will order a product because they are promising next day delivery. I could have gone to a hardware store or an auto parts store but was being lazy. Or purchased a superior product from Amazon with no rush. But I go all in on the next day delivery and they often fail. The other thing is that a regular seller that is not buying their way to the top through advertising doesn't stand a chance. Would like to turn off sponsored sellers.,2,Google Play
They are trying to make me use WhatsApp.. very suspicious!!!,1,Google Play
brilliant thanks,5,Google Play
I love scrolling on Amazon on my phone. However recently the app has developed a bug. I can use the website just the same... I need to have it known there's a bug and I can't go joyfully scrolling through Amazon anymore.,1,Google Play
Amazon ok. just Hate Notification for products i already brought. it basically annoying. Feel like removing my account.,3,Google Play
I enjoy the comfort zone I am in..,5,Google Play
the AMAZON APP really drains cell phone batteries!!!!!,1,Google Play
Easy great handy shopping experience.,5,Google Play
The shopping is great but sometimes Amazon does not make sure reputable companies are selling products under their name.,4,Google Play
good deals.,5,Google Play
Needs update for support on Razer Egde,1,Google Play
exel nfe,5,Google Play
"Constant bugs, no good deals. Constant bugs, no good deals",1,Google Play
trash give the update to fix the big already. I can't even use the app.,1,Google Play
"Amazon provide fast efficient delivery and access to a wealth of resources. However if you have a problem it is extremely hard work. Their Data security concerns me and they are extremely hard to cancel. I apparently have 5 amazing accounts, a UK one, US one, Aus one etc, have been trying to close them for 4 years. be careful",3,Google Play
it was good but it did not have the nail tips I was looking for,4,Google Play
can't search for anything. the app immediately closes after trying to use the search bar,1,Google Play
"my phone number changed and I got locked out of my account, customer support cannot change my number so im done with it and taking my business elsewhere",1,Google Play
I like how you have to get an otp from a different phone that you can't access when logging onto a different device. It's a super convenient feature. I really disliked how you could just login to your email and get a code before Nice Update! How do you login if you only have one device.,2,Google Play
Very good app easy to find stuff you need to get,5,Google Play
how do i change my cotact details,5,Google Play
it's perfect,5,Google Play
"I had to download an app from a mirror site to get it working on my tablet. why would you force me to do this? the APK works just fine though clearly not designed for tablet ofc. Devs, get your product owners told",1,Google Play
discontinued tablet support,1,Google Play
hangs when trying to switch between us and za stores. selection in sa store is sad really. why cabt we get us stire stuff in other markets with skme consolidated shipping? hasnt your ai told you to do that yet? now it keeps on popping up a nag abiut switching back to za store and throwing away my search. nice. not.,1,Google Play
"service and products are good. but, the app sucks. I have too many issues with this app.",2,Google Play
"App is completely unusable now, can't even log in without it freezing and crashing. Forget customer support, they don't even read the reviews.",1,Google Play
"The search function is worse than ebay in every way imaginable. The app is extremely slow. Tab navigation is unintuitive. You would really think a flagship company like Amazon would have an optimized app... Update: so extremely slow, how can an app this popular function this poorly? Trying to compare prices on ebay and Amazon won't load.. have to change my 2 star rating to 1 star.. *2026 edit- search still broken. I would've made another 1 star review if it let me!",1,Google Play
very good never had a problem,5,Google Play
i can't sign up for prime subscription,1,Google Play
"GO WITH EBAY. Over 60% of my orders since Jan 2025 have been late. I live in KC in the city, less than 10 miles from 3 Amazon distribution centers. Over 60% of the approx 200 orders since Jan 2025. only 80 packages arrived on time. customer service is a joke. get ready for Swarna (actual CSR) to lie and jerk you around to waste your time. I was told they would check promises delivery dates vs actual delivery dates and nothing happened. ebay has 99% on time deliveries to me.",1,Google Play
gift cards are so clutch,5,Google Play
"New AI return process shakes my confidence. Certain categories,like if you had a problem, just lead to a dead-end where the AI asks for more info but there is no way to enter it and proceed. Also, could not find any way to contact an actual human.",1,Google Play
ok so far,3,Google Play
the ads have just become ridiculous at this point. when watching an episode you'll spend more time watching ads than the show. uninstalling.,1,Google Play
app won't load after install,1,Google Play
"I have been a member for over 10 years. Christmas 2025. I ordered a 24in TV when I wanted a 32in. When returning the 24in there were no hiccups, a smooth transaction returned to my original payment. Yay!! My 2nd TV was a joke. Volume defect, when trying to return for a refund apparently the seller wanted me to pay a shipping fee. I WAS NOT going to pay to ship back to the same seller as the 24in... My refund was applied to a gift card and not my original payment. Bye-Bye Amazon!!",2,Google Play
"Is there any way to block or stop LL BEN's password book, 'S..T', from popping up on a daily basis!? I am a CHRISTIAN and I don't want to see profanity advertised every time I open up the app!!  I'm certain there are things you do to accomadate others! Ex., Islam.",3,Google Play
glitch in the latest update! can't see orders!,1,Google Play
"since the latest update, every search opens the ai instead of just taking me to the results. i, and i cannot possibly overstate this, do Not Care what the environment destroying plagiarism machine that lies has to say about my search. just show me the items thanks.",1,Google Play
"YOUR FOSSIL hates to admit it, but this newfangled Amazon doohicky is pretty spiff!",4,Google Play
Like,5,Google Play
always a good experience,5,Google Play
so fine,5,Google Play
"there stealing money from me. i tryed to cancel my amozon prime account a couple months ago but can't. they've stolen at least 32$ from me so far. i wish there was anyone or anything that would hold these evil, slimy people accountable. at all even. thanks for blatantly stealing from me and probably most of your other customers.",1,Google Play
"love this service, shipping is fast and reliable.",5,Google Play
"So easy to do, it's at my fingertips.",5,Google Play
"not available for tablets,why?",1,Google Play
"how sad that this has no support any more. it's like reading a tax law to get thru the ""help"" pages.",1,Google Play
nice,5,Google Play
"popular online shopping platform with a huge variety of products and fast delivery. It’s easy to use, prices are often competitive, and customer reviews help with buying decisions. Sometimes delivery can vary by seller, but overall it’s convenient and reliable.",5,Google Play
Not available on a brand new tablet???? This seems unrealistic.,1,Google Play
