commentaire,rating,source
easy order. easy return,5,Google Play
Just got a new Samsung Galaxy tablet and the Amazon app is not compatible! Extremely frustrating and very disappointing!,1,Google Play
"I picked up my new t.v at Best Buy!! the same day, I ordered it on.",5,Google Play
حرامية,1,Google Play
Nice platform to do shopping but it's disappointing that most items are not delivered to Oman.,3,Google Play
👌👍👌👍,5,Google Play
cant create account,1,Google Play
don't know how I lived without it,5,Google Play
I can't use my Amazon gift card for a paycheck when I don't need to spend money and they aren't allowing it so this recent update has been horrible,1,Google Play
good,5,Google Play
Always satisfied,5,Google Play
shows fomo notifications every time the screen of my phone turns on. disabled all notifications and still happened anyways.,1,Google Play
love the convince,5,Google Play
Amazon is 👍 great!!,5,Google Play
me molesta que si dice el producto q llega el dia anterior no llegue...si dice que llega cumplan no mientan porque bien caro que se paga el prime para tan mal servicio It bothers me that if you say the product that arrives the day before doesn't arrive... if you say it arrives comply don't lie because it's expensive to pay the prime for such bad service,2,Google Play
"It stopped working on my Tab A7(not compatible)and Play Store won't let me install it after I uninstalled. If you don't want to lose a very good customer Amazon, I suggest you fix this issue.",1,Google Play
it's perfect,5,Google Play
"keeps getting worse, keeps getting slower, keeps not listening to me when I filter.",1,Google Play
"app is lagging and amazon product search sucks to find the best items , gotta search through tons of knock off items to find the good ones",2,Google Play
plis Bangladesh come 🥹🥹🥹🥹,5,Google Play
"they have 1 good thing which the fast delivery, other than the lately they keep accusing customers with things we haven't done, I had 2 sellers scammed me and Amazon haven't done anything, and they got upset I did dispute, they getting worse and worse",1,Google Play
great stuff and quick delivery,5,Google Play
App no longer is available for my Samsung Tablet. (yet works on my note 20 ultra) Developer/Amazon: Will this be fixed anytime soon? Using the browser's page is way too busy when your used to the app. (ADHD brain!) I NEVER thought I'd see the day when they were steering you AWAY from installing an app!,1,Google Play
You get what you want fast and easy what more do you need. 👍🆗,5,Google Play
Great App!,5,Google Play
"Please fix for Android 16! Some screens have not implemented screen insets, buttons overlap the statusbar and cannot be interacted with. Please manually apply screen margin to the top on broken screens or update all views to compose Material Design 3 or newer. I am suck on app open due to this layout issue. Please act with some haste.",1,Google Play
"is there seriously no way to put this app into a darker or dark mode?? The apps screen is so white and bright on 90% or more of each and every page! no matter what is searched for and looked at.. if it was able to be put in a darker mode that's something different than the very VERY high contrast/brightness of the apps white usage on the background/surroundings within, than i would put my rating to the 4-5 star range. I",3,Google Play
"Not for tablets anymore?!! I've been using this app for years on my tablets, and it started glitching and locking up frequently, so I thought I'll uninstall it and reinstall it. I can't reinstall it. Google play says it's not compatible with tablets now and offers no other app in its place. why??! Now I'm stuck with the online website shopping experience, which is terrible! Customer service was a dead end. This will deter me from shopping on Amazon and may force me to cancel prime.",1,Google Play
great experience,5,Google Play
Amazon as a company was good once about ten years ago. Years later Still horrible and getting worse by the second. Prime is garbage and so is their customer service as well. Avoid at all costs. The app is a reflection of the company. Every update makes it worse and unusable. Zero improvements in years.,1,Google Play
"Always a good experience. Problems are solved efficiently and without resentment. Friendly, polite, knowledgeable staff.",5,Google Play
"This is a rating for both the app and Amazon as a whole - App becomes more agressively user-unfriendly every year. When I look for a specific game or movie, I don't need a sponsored result of dildos, laundry soap and pet food. Shipping is free and fast when you DO NOT have a Prime membership. Prices are higher than a lot of small indie stores. Most items on Amazon look to be drop ship garbage from ""stores"" like XCGSD or ZAGFRT. Amazon is no longer the good deal site. It's trash all the way down",1,Google Play
always on time and in good on all merch,5,Google Play
so probably have to uninstall this app doesn't work as intended in the brackets is the post I put nearly a year ago an your still not fixed it(options don't even work in the settings getting notifications for options I've turned off repetitively all day) are you too busy trying to push stuff on people what's unneeded,1,Google Play
worst delivery staff and customer services,1,Google Play
auto downloads even after being deleted,1,Google Play
yeah,5,Google Play
Just keeps crashing on me.,1,Google Play
"Amazon are going downhill fast, poor deliveries and terrible customer service coupled with the adverts they force upon people i would advise thinking about joining Prime as it is no longer worth the charge.",1,Google Play
"When I receive a notification on a Alexa powered device and tell the device to add a item to my cart, it doesn't always do it. it would be nice if this app had a notifications section so I can review notifications.",1,Google Play
Terrible customer service (when you can actually manage to get through to someone)! Latest order was supposed to be delivered to my local Post Office but when I went to collect the item it wasn't there. Amazon are refusing to give me a refund.,1,Google Play
"fast checkout, no fuss on getting want her or me want",5,Google Play
chat bot will not allow a human to respond to questions it can't answer.,1,Google Play
"the only problem I have is with the way that Amazon ships now. I like the various types of shipping but they're not matching the item to a package. I had a package of chips placed in the paper bag of course the project was completely ruined. And I bought a thin ""tin' sign and placed it in a non-padded bag, the sign was warped and dented.",3,Google Play
you can't cancel membership. 🤯,1,Google Play
Good 👍😊👍😊👍😊,5,Google Play
can't access to change my phone number. Amazon won't recognize my password.,1,Google Play
كويس بس بطلوا تجيبوا الاوردر غلط,5,Google Play
"Amazon needs a dark mode to their app. The pages are too bright, I turn down the brightness but it doesn't help and the lettering are too light and thin, or allow the page to be blown up so I can expand the letters",3,Google Play
great for rural life.,5,Google Play
Su servicio de entrega deja mucho que desear,1,Google Play
Love it the way of process,5,Google Play
"Absolute disaster, how can I just simply browse. Any option that gives me the ability to have a clear view of available products is not accessible.",1,Google Play
I love it 😍❤️,5,Google Play
"After repeatedly canceling an order I confirmed and reconfirmed that yes I did indeed want, they decided to cancel because I had a duplicate cancelation. I'll take my money to a brick and mortar store at actually wants and needs my money.",1,Google Play
"goods ordered, arrived on time, also good on price.",5,Google Play
Amazon app is junk and its work done to the app because you can do anything and they just cancelled your orders,2,Google Play
"Would love to be able to find a live person to chat with, call, email to solve a problem instead of an endless loop of virtual answers.",1,Google Play
"I used to love Amazon, but what an absolute cluster now... Rufus is a serious pain, popping up with absolutely no option to turn off the stupid AI bs. Also, who doesn't love paying for services that aren't guaranteed or honored? I used to pay for Prime, and for three months now, it's been a minimum delivery time of 4 days, if not longer. I canceled my prime as it now doesn't matter if I pay for it or not, my shipments arrive in the same time frame regardless...",2,Google Play
expensive,1,Google Play
EL SERVICIO A CLIENTE ES UNA BASURA. ME COMUNIQUE CON ELLOS POR UN PAQUETE QUE DICEN HABERME ENTREGADO Y NO ME DIERON SOLUCIÓN.,1,Google Play
"I ask Amazon to STOP showing what we did NOT ask. Example: I look for ONLY ENTERIC COATED capsules, show me only ENTERIC COATED. Stop trying to push products into our eyes that we are not looking for. STICK to what we type ONLY !!!! Same with the brands, uf I ask one specific brand, STOP showing me what I NEVER asked.",2,Google Play
"This app has gotten extremely slow. my phone is not the newest but it's also not ancient. I've done all the things, checked my internet, cleared the cache, reinstalled etc. but just switching in between options in a listing is extremely laggy.",1,Google Play
I have always had great experience and service here,5,Google Play
Amazon has what I need. Tried of driving to a store and not finding what I need.,5,Google Play
Easy to find what you want. Easy to compare sellers.,5,Google Play
For the last 2 days Amazon keeps glitching as soon as I try to search for anything and just closes. It said to update the app but it's already updated and I have cleared the cache also with no luck.,1,Google Play
App keeps crashing due to a bug. Please fix!,3,Google Play
don't have useless apps on my phone,1,Google Play
سرقه علني بمعني الكلمه؛ كنسلوا طلباتي canceled my orders و خدوا مني الكوبونات اللي هي عباره عن استرجاع مبالغ من طلب قديم جه غلط؛ و لما جيت اكلمهم قعدوا يرموني علي بعض و اديني شهر مخدتش منهم حق و لا باطل لحد ما مليت و قفلت حسابي و قولت حسبي الله و نعم الوكيل فيهم ... مقاطعه,1,Google Play
there is no customer support..,1,Google Play
happy with this amp 😃😁 6:14 am 2/25/26 Dorothy Riggs,5,Google Play
Pages are not user-friendly. It is too hard to find help or get answers to your questions.,3,Google Play
"Why is Amazon shopping no longer compatible with my tablet. This needs to be fixed. Was using my tablet to check on an Amazon order I placed 2 days ago and now this. What is needed to make the app work again on my tablet. every time something works fine, it gets messed with or taken down. I am not happy about this.",1,Google Play
النهاردة 25/2/2026 الدليفري رفض توصيل الشحنة وأمازون حالته مزرية,1,Google Play
"Amazon shopping great ,didn't no you could by food off there. But when my clients send me gift cards for anything, now I do my food shopping for paymentsx",5,Google Play
this app just ain't working anymore,1,Google Play
"The app has recently become a huge pain, sending clickbait push notifications multiple times per hour. At this point it's just spam, uninstalled until they fix it",1,Google Play
quit it,1,Google Play
excellent,5,Google Play
Good 👍,5,Google Play
app is buggy and is shutting down suddenly. also the prices/ quality is no longer viable,1,Google Play
"Previous iterations of this app were really good. Unfortunately, the latest update has broken some of this functionality. Wish lists created prior to this new app being installed no longer show up in the app, and the Kindle Unlimited functionality is much worse than it used to be. The new app seems to focus a lot more on shipping for goods, with books given much less attention.",2,Google Play
"so easy, almost anything you need.",5,Google Play
can be checked and changed be careful 🧐 will hurt your whole 🌎 mind ur self,1,Google Play
"I don't want or have any need for your story. I've got my own and you ain't in it. for reels. if there was a way to opt out of giving any stars, I would have given two of those to you.",1,Google Play
"Since I started ordering stuff on Amazon ALL my orders have been with a mistaken mobile number, which means I need to call the delivery company every time to let them know. It has been so that I forgot about an order and never made the call => never received the package and was returned. This is absurd... How do you mistake my mobile number for every order and I know I have given you the right one?",2,Google Play
كذا مره اطلب حاجات متجيش زي الوصف والجوده سيئه وكمان مشترط عليا اني ادفع قبل الاستلام طبعا انا مسحت الابليكشن,1,Google Play
"their policy is so silly. if it's dormant for more than a year, the account will be locked forever and you have to either create a new email address for a new account or use mobile number to create a new account.",1,Google Play
Dark mode please!!!!!,2,Google Play
just opened account,5,Google Play
very cool when I can use it.,5,Google Play
I was an Amazon Vine Member. I wrote product reviews for 4+yrs. We were encouraged (indirectly) to lie b/c of the way the rules were setup for submitting reviews. Many reviews are denied for using language & vocab that most accurately describes honest product experiences. Amazon operates in a legal grey area. Now they refuse me access to my tax documents. I reported them to the IRS & the Attorney General & am working on filing a lawsuit for various reasons. This app is untrustworthy!,1,Google Play
stop choosing my payment method and stick to my default account. I don't need AI help.,4,Google Play
"Every time I search for books, I purposely choose PRINT, hardcover or paperback; yet it always chooses audiobooks!! Make it work accurately!! This has been happening for at least 6 months.",1,Google Play
I'm shamed that Amazon Shopping is not supported any longer on Tablets. They will lose a lot of customers this way. I will start shopping elsewhere unless they fix this asap.,1,Google Play
everything you'll ever want at your fingertips 🎉 my favorite way to shop,5,Google Play
"i keep hitting the ""add to upcoming delivery"" while trying to scroll through items, this is a horrible feature and has been causing SO many issues!!",1,Google Play
worst app ever freezes every time you try to open your orders tab,1,Google Play
always amazing support and services I truly appreciate Amazon,5,Google Play
Great service!!,5,Google Play
Love Prime ❤️ fast delivery 👌,5,Google Play
buying iphone 17 pro max accessories just because reasonable price 😍,5,Google Play
why doesn't it allow me to uninstall this app,1,Google Play
it won't load past the pickup screen junk app fix your software,1,Google Play
"why is this app now saying it's no longer compatible with my tablet, won't let me download it all. It's the only Amazon app responding this way. id really appreciate a response and solution to this.. I sure noticed they had no problem taking my monthly prime payment but where's my app to access the service I'm subscribed to???",1,Google Play
"Intrigued by the attached app,the very appropriate moment I viewed the advertised link,my thoughts were highly adjusted positively so,I did not hesitate to complete the signup program so that I can receive my product,few days later my parcel was delivered 😀. Safe and secured. I m really happy to have the opportunity to use this app .keep the good service up.",5,Google Play
Best place in the world to buy things from,5,Google Play
"Enjoy the range/variety of options for purchase. Great prices, and free shipping is awesome.",5,Google Play
almost everything is on Amazon lol 🤷🏽‍♂️ it's true.,5,Google Play
slow and crashes. you're better off using the website.,3,Google Play
So super easy to get what I need! as a disabled lady who cant get far or often I have very rarely in thousand of orders been disapointed and always rectified fast if any issues . retail therepy at its finest ! With so many choices and even the essentials range you cant go wrong with finding a great product for what you need.,5,Google Play
Keeps crashing!,2,Google Play
the app does not work with the Samsung galaxy Tab A11+ and is missing from the UK play store,1,Google Play
Why is it so incredibly hard to find my digital rewards balance for choosing Amazon day delivery?,1,Google Play
cheap items are really expensive here a 240k laptop on Amazon is 300k,2,Google Play
"I'm trying to talk to customer service about an item, but if I go into customer service, it just is a continual loop bringing me back to the customer service page. it won't let me talk to anyone. Amazon is garbage.",1,Google Play
fabulous,5,Google Play
"really bad experience, I had prime and everything works great, but they are only trying to get extra money out of prime plus what they get from the sells, I purchased 2 items in one transaction Feb 13th 2026 1st arrived Feb Feb 22nd the other one hasn't even shipped yet. and it is 5:15 pm on Feb 24th? man, stuff from China stores arrives way faster and you can see their strategy, ""pay prime, we'll ship right away, no prime forget about it"". Amazon sucks.",1,Google Play
tried to order something and got my account locked even after I did what it asked to reactivate my account. now I cant even make a new account...,1,Google Play
Cannot get thru the stupid new AI return que. No option to type in responses. Or get all the way through a return How irritating!! And for 6 months reading reviews has not worked. It's always jumping back to the beginning.,1,Google Play
Perfect,5,Google Play
amazon is not the same u order and they send it whenever they want,1,Google Play
"They use to be great but they have gotten worse and worse on deliveries, one second its being delivered today, next it's says tomorrow, then it says a week from today and you now have to got through the refund process and try to find what you needed in a timely manner. That's not happening here anymore at all!",2,Google Play
worse service,1,Google Play
app has a bug keep closing.,1,Google Play
This app keeps signing me up for Amazon Prime. 🤬🤬🤬,1,Google Play
I want to cancel my order,1,Google Play
I have been with Amazon since 2020 and order almost daily.No other retail company can match their prices and service.,5,Google Play
no problems,5,Google Play
"Latest update is AWFUL, as usual for any Amazon operated app. Horrible user interface that moves at a snails pace. So slow it's now rendered completely unusable. Doesn't really matter though, because the search results are now so completely irrelevant to what you searched and so cluttered with useless added garbage you won't be bothered to click on anything anyway. Time to send these robot clowns back to whatever mail room they came from and hire someone actually qualified to design apps.",1,Google Play
it works as it should.,5,Google Play
Almost impossible to get live help. terrible customer service. They put you in AI hell and hide live help very effectively. Terrible business practice.,1,Google Play
so futerated as I went pick up packages I had sent to drop off location to avoid theft and app will not work now on my tablet/ cell so now can't get my packages. really need to fix this issue as they will lose my business till they do as well expect some kind of credit for major inconvenience of having to shop some where else now and paid for prime I can't even use as I can't pick up packages now as app will not down load to my tablet 😑.,1,Google Play
awesome,5,Google Play
great to do shopping,2,Google Play
my go to spot,5,Google Play
I really enjoyed this app it's a convenience to have it.,5,Google Play
Amazon the best ever 🥰,5,Google Play
laggy. takes ages to load or won't load at all. terrible and slow,1,Google Play
Great not bad as Ebay,4,Google Play
good,5,Google Play
totally awesome,5,Google Play
"very poor service, didn't deserve 1 star",1,Google Play
love it,5,Google Play
"I dont know what's going on, but 2 of my orders, different times. Have not been delivered and tracking stops. I have the option to cancel so it says. I do then NOTHING, NOT MY MONEY BACK, not any other follow up. Sus Sus!",2,Google Play
"2 day shipping doesn't exist. It will say that it will be delivered in two days. But the day it's supposed to be delivered, you will get a notification late that day, saying that it won't be delivered till the next day. And then the same will happen the next day. Also, apparently, now, when your package shows delivered, well, you know, they say it can show delivered forty eight hours before it is actually delivered. How is that legal? I have no idea, but I'm done.",1,Google Play
"I was about to shop for a 430 EUR item on Amazon, everything went smoothly, but after they asked for account verification and I completed the process, they debited the cash from my account and then canceled the order. They're saying the cash will come back in 3-5 days. Is this right? It makes me really annoyed to deal with them like this.😌",1,Google Play
I get my orders delivered to the hub locker read supermarket I can't scan my phone I have to call customer service for the code to get my orders please fix,1,Google Play
"Pick Noon, they honor their delivery dates. While amazon used to focus on reliability in the delivery times, this is long past. Out of 10 orders i made during the last month 9 of them were delayed by more than 3 days and im a prime member. The issues comes from the third party services they use like (Aramex, etc). Once these companies take the order they dont have to deliver it on the agreed date, they deliver based on the schedule of the delivery person, you dont matter.",1,Google Play
very nice,4,Google Play
انا طلبت أوردر وجاي ناقص والخامه رديئه جدا عكس الصوره تماما,1,Google Play
Amazon's mobile app is so slow and laggy these days that it's almost unusable. Opening a browser page is faster so I'm considering dumping the app in favor of that.,1,Google Play
we all have the needs to be to be shopping on Amazon.. who don't use it if didn't you will.,4,Google Play
best application forever,5,Google Play
"Always on Time, Product guarante what you see what you get...",5,Google Play
Its been glitch lately. Unable to use the app.,1,Google Play
"for some reason.. my Amazon app set its code to ""Amazon.ae"" instead of "".ca"" ... I Uninstalled the app.. re-download it from the play store... and it went back to Canada.",4,Google Play
"Join Prime and if you place your order in the next 4 hours, it will arrive today, LIES! I paid for prime and placed my order and all of a sudden it's tomorrow and the next day on the same order. These tactics are deceptive to get you to join a membership and then cannot follow through with the promises... I will never get prime again.",1,Google Play
"pixel 9, new sign in notification page's ""x"" is hidden in the top left under the notification bar area, inaccessible causing it to reappear with every open of the app",3,Google Play
my package never showed uup,2,Google Play
keeps crashing every time i search for an item,1,Google Play
went to cancel my order because I found an item cheaper elsewhere. they sent email saying they couldn't cancel my order. 1 min later I got email my items shipped. there's you a life hack to get Amazon to ship your stuff faster I guess. my order was 26 dollars. so in punishment I'll pause my prime membership for 2 months. I will get my money back one way or another. as my stuff is non returnable. and 2 months I won't buy anything else as well. they just didn't want to cancel it.,1,Google Play
it's 2025 and the largest retailer on the planet doesn't have dark mode on their app. I'd like to order gifts at 3 a.m. without blinding myself and waking up half the county,1,Google Play
simply the best.,5,Google Play
is a great shopping online app,5,Google Play
Great service and excellent delivery time.,5,Google Play
dont bother with prime says delivery next day then you get message for delay and say will arrive two days time so standard delivery,1,Google Play
New update is hard to navigate. Lots of scrolling left/right to find what you're looking for.,2,Google Play
Where is dark mode? I can't find it anywhere. Why do I need to wear sunblock when I check the status of my order at night? Where is the search function for comments? Not there. What're we waiting for???,1,Google Play
will change when they add a dark mode. and also when they drop the price of prime. great app otherwise.,1,Google Play
UPDATE: WELL IT'S 2026 AND YET AGAIN THE APP KEEPS CLOSING SAYING THERE'S A DEVELOPER ISSUE! 2021: Not working again ugh,5,Google Play
my Amazon USA switched to Amazon sa and now it won't go back. how do I fix this?,1,Google Play
Just GREAT and jandy,5,Google Play
"Go back to using the postal service for God's sake, seriously every order I've made has ended up arriving one to two days late. It feels like paying for prime is worthless at this point.",2,Google Play
cannot view in dark mode,3,Google Play
"I've been trying to talk to an agent for 1 hour and 19 minutes, Everytime I get close to talking to someone I get an error 'ooops something went wrong' or it just takes me back home so I can start all over again. I have lost my patience with you. It is so wrong to treat your customers like this. I will be taking my business elsewhere.",1,Google Play
good,5,Google Play
